{
  "$schema": "https://json-schema.org/draft/2020-12/schema",
  "$id": "https://weconnect.local/schemas/route-manifest.v1.schema.json",
  "title": "WeConnect Route Manifest v1",
  "type": "object",
  "additionalProperties": false,
  "required": [
    "protocol",
    "protocolVersion",
    "id",
    "packageName",
    "displayName",
    "version",
    "description",
    "engines",
    "capabilities",
    "permissions"
  ],
  "properties": {
    "$schema": { "type": "string" },
    "protocol": { "const": "weconnect.route" },
    "protocolVersion": { "const": 1 },
    "id": { "type": "string", "pattern": "^[a-z][a-z0-9-]{1,63}$" },
    "packageName": {
      "type": "string",
      "pattern": "^(?:@[a-z0-9][a-z0-9._-]*/)?[a-z0-9][a-z0-9._-]*$"
    },
    "displayName": { "type": "string", "minLength": 1 },
    "version": {
      "type": "string",
      "pattern": "^\\d+\\.\\d+\\.\\d+(?:-[0-9A-Za-z.-]+)?(?:\\+[0-9A-Za-z.-]+)?$"
    },
    "description": { "type": "string", "minLength": 1 },
    "license": { "type": "string", "minLength": 1 },
    "author": {
      "type": "object",
      "additionalProperties": false,
      "required": ["name"],
      "properties": {
        "name": { "type": "string", "minLength": 1 },
        "url": { "type": "string", "format": "uri" }
      }
    },
    "homepage": { "type": "string", "format": "uri" },
    "repository": { "type": "string", "minLength": 1 },
    "engines": {
      "type": "object",
      "additionalProperties": false,
      "required": ["weconnect"],
      "properties": {
        "weconnect": { "type": "string", "minLength": 1 },
        "node": { "type": "string", "minLength": 1 }
      }
    },
    "capabilities": {
      "type": "array",
      "uniqueItems": true,
      "items": { "type": "string", "minLength": 1 }
    },
    "permissions": {
      "type": "array",
      "items": {
        "type": "object",
        "additionalProperties": false,
        "required": ["name", "reason"],
        "properties": {
          "name": { "type": "string", "minLength": 1 },
          "reason": { "type": "string", "minLength": 1 },
          "optional": { "type": "boolean" }
        }
      }
    }
  }
}
